{
  "attribution": {
    "label": "Open-Meteo · CC BY 4.0",
    "licenseUrl": "https://creativecommons.org/licenses/by/4.0/",
    "providerUrl": "https://open-meteo.com/"
  },
  "calendar": {
    "cutoff": "2026-09-13T03:00:00.000Z",
    "date": "2026-09-12",
    "dayEnd": "2026-09-13T07:00:00.000Z",
    "dayStart": "2026-09-12T07:00:00.000Z",
    "sunset": "2026-09-13T02:27:49.262Z"
  },
  "generatedAt": "2026-09-12T15:15:00.000Z",
  "hours": [
    {
      "end": "2026-09-12T08:00:00.000Z",
      "rainMmPerHour": {
        "mode": "raw",
        "raw": 0,
        "rawSource": {
          "runAt": "2026-09-12T09:15:00.000Z",
          "receivedAt": "2026-09-12T15:10:00.000Z"
        },
        "reason": "raw_forecast",
        "selected": 0,
        "selectedSource": null,
        "selectedUntil": null
      },
      "start": "2026-09-12T07:00:00.000Z",
      "temperatureC": {
        "mode": "adjusted",
        "raw": 10,
        "rawSource": {
          "runAt": "2026-09-12T09:15:00.000Z",
          "receivedAt": "2026-09-12T15:10:00.000Z"
        },
        "reason": "independent_adjustment",
        "selected": 10,
        "selectedSource": {
          "runAt": "2026-09-12T00:00:00.000Z",
          "receivedAt": "2026-09-12T01:00:00.000Z"
        },
        "selectedUntil": "2026-09-12T16:00:00.000Z"
      }
    },
    {
      "end": "2026-09-12T09:00:00.000Z",
      "rainMmPerHour": {
        "mode": "raw",
        "raw": 0.01,
        "rawSource": {
          "runAt": "2026-09-12T09:15:00.000Z",
          "receivedAt": "2026-09-12T15:10:00.000Z"
        },
        "reason": "raw_forecast",
        "selected": 0.01,
        "selectedSource": null,
        "selectedUntil": null
      },
      "start": "2026-09-12T08:00:00.000Z",
      "temperatureC": {
        "mode": "adjusted",
        "raw": 10.1,
        "rawSource": {
          "runAt": "2026-09-12T09:15:00.000Z",
          "receivedAt": "2026-09-12T15:10:00.000Z"
        },
        "reason": "independent_adjustment",
        "selected": 10.1,
        "selectedSource": {
          "runAt": "2026-09-12T01:00:00.000Z",
          "receivedAt": "2026-09-12T02:00:00.000Z"
        },
        "selectedUntil": "2026-09-12T16:00:00.000Z"
      }
    },
    {
      "end": "2026-09-12T10:00:00.000Z",
      "rainMmPerHour": {
        "mode": "raw",
        "raw": 0.02,
        "rawSource": {
          "runAt": "2026-09-12T09:15:00.000Z",
          "receivedAt": "2026-09-12T15:10:00.000Z"
        },
        "reason": "raw_forecast",
        "selected": 0.02,
        "selectedSource": null,
        "selectedUntil": null
      },
      "start": "2026-09-12T09:00:00.000Z",
      "temperatureC": {
        "mode": "adjusted",
        "raw": 10.2,
        "rawSource": {
          "runAt": "2026-09-12T09:15:00.000Z",
          "receivedAt": "2026-09-12T15:10:00.000Z"
        },
        "reason": "independent_adjustment",
        "selected": 10.2,
        "selectedSource": {
          "runAt": "2026-09-12T02:00:00.000Z",
          "receivedAt": "2026-09-12T03:00:00.000Z"
        },
        "selectedUntil": "2026-09-12T16:00:00.000Z"
      }
    },
    {
      "end": "2026-09-12T11:00:00.000Z",
      "rainMmPerHour": {
        "mode": "raw",
        "raw": 0.03,
        "rawSource": {
          "runAt": "2026-09-12T09:15:00.000Z",
          "receivedAt": "2026-09-12T15:10:00.000Z"
        },
        "reason": "raw_forecast",
        "selected": 0.03,
        "selectedSource": null,
        "selectedUntil": null
      },
      "start": "2026-09-12T10:00:00.000Z",
      "temperatureC": {
        "mode": "adjusted",
        "raw": 10.3,
        "rawSource": {
          "runAt": "2026-09-12T09:15:00.000Z",
          "receivedAt": "2026-09-12T15:10:00.000Z"
        },
        "reason": "independent_adjustment",
        "selected": 10.3,
        "selectedSource": {
          "runAt": "2026-09-12T03:00:00.000Z",
          "receivedAt": "2026-09-12T04:00:00.000Z"
        },
        "selectedUntil": "2026-09-12T16:00:00.000Z"
      }
    },
    {
      "end": "2026-09-12T12:00:00.000Z",
      "rainMmPerHour": {
        "mode": "raw",
        "raw": 0.04,
        "rawSource": {
          "runAt": "2026-09-12T09:15:00.000Z",
          "receivedAt": "2026-09-12T15:10:00.000Z"
        },
        "reason": "raw_forecast",
        "selected": 0.04,
        "selectedSource": null,
        "selectedUntil": null
      },
      "start": "2026-09-12T11:00:00.000Z",
      "temperatureC": {
        "mode": "adjusted",
        "raw": 10.4,
        "rawSource": {
          "runAt": "2026-09-12T09:15:00.000Z",
          "receivedAt": "2026-09-12T15:10:00.000Z"
        },
        "reason": "independent_adjustment",
        "selected": 10.4,
        "selectedSource": {
          "runAt": "2026-09-12T04:00:00.000Z",
          "receivedAt": "2026-09-12T05:00:00.000Z"
        },
        "selectedUntil": "2026-09-12T16:00:00.000Z"
      }
    },
    {
      "end": "2026-09-12T13:00:00.000Z",
      "rainMmPerHour": {
        "mode": "raw",
        "raw": 0,
        "rawSource": {
          "runAt": "2026-09-12T09:15:00.000Z",
          "receivedAt": "2026-09-12T15:10:00.000Z"
        },
        "reason": "raw_forecast",
        "selected": 0,
        "selectedSource": null,
        "selectedUntil": null
      },
      "start": "2026-09-12T12:00:00.000Z",
      "temperatureC": {
        "mode": "adjusted",
        "raw": 10.5,
        "rawSource": {
          "runAt": "2026-09-12T09:15:00.000Z",
          "receivedAt": "2026-09-12T15:10:00.000Z"
        },
        "reason": "independent_adjustment",
        "selected": 10.5,
        "selectedSource": {
          "runAt": "2026-09-12T05:00:00.000Z",
          "receivedAt": "2026-09-12T06:00:00.000Z"
        },
        "selectedUntil": "2026-09-12T16:00:00.000Z"
      }
    },
    {
      "end": "2026-09-12T14:00:00.000Z",
      "rainMmPerHour": {
        "mode": "raw",
        "raw": 0.06,
        "rawSource": {
          "runAt": "2026-09-12T09:15:00.000Z",
          "receivedAt": "2026-09-12T15:10:00.000Z"
        },
        "reason": "raw_forecast",
        "selected": 0.06,
        "selectedSource": null,
        "selectedUntil": null
      },
      "start": "2026-09-12T13:00:00.000Z",
      "temperatureC": {
        "mode": "adjusted",
        "raw": 10.6,
        "rawSource": {
          "runAt": "2026-09-12T09:15:00.000Z",
          "receivedAt": "2026-09-12T15:10:00.000Z"
        },
        "reason": "independent_adjustment",
        "selected": 10.6,
        "selectedSource": {
          "runAt": "2026-09-12T06:00:00.000Z",
          "receivedAt": "2026-09-12T07:00:00.000Z"
        },
        "selectedUntil": "2026-09-12T16:00:00.000Z"
      }
    },
    {
      "end": "2026-09-12T15:00:00.000Z",
      "rainMmPerHour": {
        "mode": "raw",
        "raw": 0.07,
        "rawSource": {
          "runAt": "2026-09-12T09:15:00.000Z",
          "receivedAt": "2026-09-12T15:10:00.000Z"
        },
        "reason": "raw_forecast",
        "selected": 0.07,
        "selectedSource": null,
        "selectedUntil": null
      },
      "start": "2026-09-12T14:00:00.000Z",
      "temperatureC": {
        "mode": "adjusted",
        "raw": 10.7,
        "rawSource": {
          "runAt": "2026-09-12T09:15:00.000Z",
          "receivedAt": "2026-09-12T15:10:00.000Z"
        },
        "reason": "independent_adjustment",
        "selected": 10.7,
        "selectedSource": {
          "runAt": "2026-09-12T07:00:00.000Z",
          "receivedAt": "2026-09-12T08:00:00.000Z"
        },
        "selectedUntil": "2026-09-12T16:00:00.000Z"
      }
    },
    {
      "end": "2026-09-12T16:00:00.000Z",
      "rainMmPerHour": {
        "mode": "raw",
        "raw": 0.08,
        "rawSource": {
          "runAt": "2026-09-12T09:15:00.000Z",
          "receivedAt": "2026-09-12T15:10:00.000Z"
        },
        "reason": "raw_forecast",
        "selected": 0.08,
        "selectedSource": null,
        "selectedUntil": null
      },
      "start": "2026-09-12T15:00:00.000Z",
      "temperatureC": {
        "mode": "adjusted",
        "raw": 10.8,
        "rawSource": {
          "runAt": "2026-09-12T09:15:00.000Z",
          "receivedAt": "2026-09-12T15:10:00.000Z"
        },
        "reason": "independent_adjustment",
        "selected": 10.8,
        "selectedSource": {
          "runAt": "2026-09-12T08:00:00.000Z",
          "receivedAt": "2026-09-12T09:00:00.000Z"
        },
        "selectedUntil": "2026-09-12T16:00:00.000Z"
      }
    },
    {
      "end": "2026-09-12T17:00:00.000Z",
      "rainMmPerHour": {
        "mode": "raw",
        "raw": 0.09,
        "rawSource": {
          "runAt": "2026-09-12T09:15:00.000Z",
          "receivedAt": "2026-09-12T15:10:00.000Z"
        },
        "reason": "raw_forecast",
        "selected": 0.09,
        "selectedSource": null,
        "selectedUntil": null
      },
      "start": "2026-09-12T16:00:00.000Z",
      "temperatureC": {
        "mode": "adjusted",
        "raw": null,
        "rawSource": null,
        "reason": "independent_adjustment",
        "selected": 10,
        "selectedSource": {
          "runAt": "2026-09-12T09:00:00.000Z",
          "receivedAt": "2026-09-12T10:00:00.000Z"
        },
        "selectedUntil": "2026-09-12T16:00:00.000Z"
      }
    },
    {
      "end": "2026-09-12T18:00:00.000Z",
      "rainMmPerHour": {
        "mode": "raw",
        "raw": 0,
        "rawSource": {
          "runAt": "2026-09-12T09:15:00.000Z",
          "receivedAt": "2026-09-12T15:10:00.000Z"
        },
        "reason": "raw_forecast",
        "selected": 0,
        "selectedSource": null,
        "selectedUntil": null
      },
      "start": "2026-09-12T17:00:00.000Z",
      "temperatureC": {
        "mode": "adjusted",
        "raw": 11,
        "rawSource": {
          "runAt": "2026-09-12T09:15:00.000Z",
          "receivedAt": "2026-09-12T15:10:00.000Z"
        },
        "reason": "independent_adjustment",